{
  "schema_version": "1.0",
  "plugin_id": "finance.budget.reserve_check",
  "plugin_version": "0.1.0",
  "manifest_sha256": "5c7ab506e4a2705fb4d377070d682c96af5092b493c6a476694f5fed7f178cdb",
  "domain": "finance",
  "description": "只读校验计划餐饮消费后是否能保留用户指定的最低剩余预算，仅输出布尔判断，不读取或修改原始账户数据。",
  "keywords": [
    "餐饮预算",
    "剩余预算",
    "最低保留",
    "预算底线",
    "只读校验",
    "订单草稿前置检查"
  ],
  "examples": [
    {
      "utterance": "帮我找一份清淡盖饭，含配送费不超过30元，检查本月餐饮预算和可用现金，只生成订单草稿，不真正下单或支付；吃完这顿饭后，这个月至少还要剩15元餐饮预算。",
      "intent": {
        "goal": "为一份清淡盖饭生成订单草稿，同时确认消费不超过30元后本月餐饮预算仍至少保留15元",
        "requested_outputs": [
          "order.draft",
          "budget.assessment",
          "budget.reserve_preserved"
        ],
        "facts": {
          "meal.query": "盖饭",
          "meal.taste": "清淡",
          "spending.max_cny": 30,
          "budget.month": "2026-10",
          "budget.min_remaining_cny": 15
        },
        "gates": [
          {
            "fact": "budget.within_limits",
            "equals": true
          },
          {
            "fact": "budget.reserve_preserved",
            "equals": true
          }
        ],
        "requires_confirmation": true,
        "authorized_effects": [],
        "constraints": {
          "place_order": false,
          "make_payment": false
        },
        "language": "zh-CN",
        "utterance": "帮我找一份清淡盖饭，含配送费不超过30元，检查本月餐饮预算和可用现金，只生成订单草稿，不真正下单或支付；吃完这顿饭后，这个月至少还要剩15元餐饮预算。",
        "adapter": "local"
      }
    },
    {
      "utterance": "帮我找一份清淡盖饭，含配送费不超过30元，检查本月餐饮预算和可用现金，只生成订单草稿，不真正下单或支付；吃完这顿饭后，这个月至少还要剩20元餐饮预算。",
      "intent": {
        "goal": "为一份清淡盖饭生成订单草稿，同时确认消费不超过30元后本月餐饮预算仍至少保留20元",
        "requested_outputs": [
          "order.draft",
          "budget.assessment",
          "budget.reserve_preserved"
        ],
        "facts": {
          "meal.query": "盖饭",
          "meal.taste": "清淡",
          "spending.max_cny": 30,
          "budget.month": "2026-10",
          "budget.min_remaining_cny": 20
        },
        "gates": [
          {
            "fact": "budget.within_limits",
            "equals": true
          },
          {
            "fact": "budget.reserve_preserved",
            "equals": true
          }
        ],
        "requires_confirmation": true,
        "authorized_effects": [],
        "constraints": {
          "place_order": false,
          "make_payment": false
        },
        "language": "zh-CN",
        "utterance": "帮我找一份清淡盖饭，含配送费不超过30元，检查本月餐饮预算和可用现金，只生成订单草稿，不真正下单或支付；吃完这顿饭后，这个月至少还要剩20元餐饮预算。",
        "adapter": "local"
      }
    },
    {
      "utterance": "帮我找一份清淡盖饭，含配送费不超过30元，检查本月餐饮预算和可用现金，只生成订单草稿，不真正下单或支付；吃完这顿饭后，这个月至少还要剩50元餐饮预算。",
      "intent": {
        "goal": "为一份清淡盖饭生成订单草稿，同时确认消费不超过30元后本月餐饮预算仍至少保留50元",
        "requested_outputs": [
          "order.draft",
          "budget.assessment",
          "budget.reserve_preserved"
        ],
        "facts": {
          "meal.query": "盖饭",
          "meal.taste": "清淡",
          "spending.max_cny": 30,
          "budget.month": "2026-10",
          "budget.min_remaining_cny": 50
        },
        "gates": [
          {
            "fact": "budget.within_limits",
            "equals": true
          },
          {
            "fact": "budget.reserve_preserved",
            "equals": true
          }
        ],
        "requires_confirmation": true,
        "authorized_effects": [],
        "constraints": {
          "place_order": false,
          "make_payment": false
        },
        "language": "zh-CN",
        "utterance": "帮我找一份清淡盖饭，含配送费不超过30元，检查本月餐饮预算和可用现金，只生成订单草稿，不真正下单或支付；吃完这顿饭后，这个月至少还要剩50元餐饮预算。",
        "adapter": "local"
      }
    }
  ],
  "negative_examples": [
    {
      "utterance": "直接帮我把这份盖饭下单并支付。",
      "reason": "该请求要求真实下单与支付，超出只读预算校验和订单草稿的能力范围；系统仅允许生成草稿，禁止真实交易。"
    },
    {
      "utterance": "告诉我我的现金账户余额和所有持仓明细。",
      "reason": "请求访问原始现金账户和持仓明细，属于隐私金融数据，且超出预算底线校验所需的最小事实范围。"
    }
  ],
  "fact_dependencies": {
    "budget.reserve_preserved": [
      "budget.assessment",
      "budget.min_remaining_cny"
    ]
  },
  "required_permissions": [
    "finance_budget:read"
  ],
  "supported_manifest_versions": [
    "0.1.0"
  ],
  "adaptation_mode": "dynamic_context"
}
